[
  {
    "relation_id": "rel-near-1",
    "subject_id": "102211a6-9d1d-477e-a081-e5ef0756cf9a",
    "predicate": "near",
    "object_id": "8276da53-2a80-4eb0-859c-a51d37bf9a0a",
    "relation_type": "spatial",
    "directionality": "symmetric",
    "confidence": 0.8,
    "tolerance_context": {
      "linear_tolerance": 0.05,
      "angular_tolerance": 2.0,
      "unit_system": "model_unit"
    },
    "observation_refs": [
      "obs:distance:102211a6-9d1d-477e-a081-e5ef0756cf9a:8276da53-2a80-4eb0-859c-a51d37bf9a0a",
      "obs:bbox-gap:102211a6-9d1d-477e-a081-e5ef0756cf9a:8276da53-2a80-4eb0-859c-a51d37bf9a0a"
    ],
    "limitations": [
      "threshold_dependent",
      "bbox_proximity_proxy"
    ],
    "derived_from": [
      "geometry_schema.v1.json"
    ],
    "assertion_level": "candidate",
    "inference_basis": "bbox_gap_within_tolerance",
    "measurement_method": "aabb_gap",
    "verification_status": "unverified",
    "verification_required": [
      "tolerance_review"
    ],
    "confidence_basis": [
      "distance threshold and bbox gap proxy"
    ]
  },
  {
    "relation_id": "rel-touching-candidate-2",
    "subject_id": "102211a6-9d1d-477e-a081-e5ef0756cf9a",
    "predicate": "touches",
    "object_id": "8276da53-2a80-4eb0-859c-a51d37bf9a0a",
    "relation_type": "spatial",
    "directionality": "symmetric",
    "confidence": 0.76,
    "tolerance_context": {
      "linear_tolerance": 0.05,
      "angular_tolerance": 2.0,
      "unit_system": "model_unit"
    },
    "observation_refs": [
      "obs:touching_candidate:102211a6-9d1d-477e-a081-e5ef0756cf9a:8276da53-2a80-4eb0-859c-a51d37bf9a0a",
      "obs:bbox-gap:0.000000"
    ],
    "limitations": [
      "bbox_based",
      "candidate_relation",
      "requires_brep_contact_check"
    ],
    "derived_from": [
      "geometry_schema.v2.json"
    ],
    "assertion_level": "candidate",
    "inference_basis": "bbox_gap_within_tolerance",
    "measurement_method": "aabb_gap",
    "verification_status": "unverified",
    "verification_required": [
      "brep_contact_check"
    ],
    "confidence_basis": [
      "aabb gap within contact tolerance"
    ]
  },
  {
    "relation_id": "rel-coplanar-candidate-3",
    "subject_id": "102211a6-9d1d-477e-a081-e5ef0756cf9a",
    "predicate": "coplanar_with",
    "object_id": "8276da53-2a80-4eb0-859c-a51d37bf9a0a",
    "relation_type": "spatial",
    "directionality": "symmetric",
    "confidence": 0.73,
    "tolerance_context": {
      "linear_tolerance": 0.05,
      "angular_tolerance": 2.0,
      "unit_system": "model_unit"
    },
    "observation_refs": [
      "obs:coplanar_candidate:102211a6-9d1d-477e-a081-e5ef0756cf9a:8276da53-2a80-4eb0-859c-a51d37bf9a0a"
    ],
    "limitations": [
      "bbox_based",
      "candidate_relation",
      "requires_brep_contact_check"
    ],
    "derived_from": [
      "geometry_schema.v2.json"
    ],
    "assertion_level": "candidate",
    "inference_basis": "face_normal_similarity",
    "measurement_method": "face_normal_dot_product",
    "verification_status": "partially_verified",
    "verification_required": [
      "face_adjacency_check"
    ],
    "confidence_basis": [
      "face normal compatibility plus bbox plane alignment"
    ]
  },
  {
    "relation_id": "rel-aligned-4",
    "subject_id": "102211a6-9d1d-477e-a081-e5ef0756cf9a",
    "predicate": "aligned_with",
    "object_id": "8276da53-2a80-4eb0-859c-a51d37bf9a0a",
    "relation_type": "spatial",
    "directionality": "symmetric",
    "confidence": 0.72,
    "tolerance_context": {
      "linear_tolerance": 0.05,
      "angular_tolerance": 2.0,
      "unit_system": "model_unit"
    },
    "observation_refs": [
      "obs:principal-axis:102211a6-9d1d-477e-a081-e5ef0756cf9a:8276da53-2a80-4eb0-859c-a51d37bf9a0a",
      "obs:obb-axis-dot:1.000"
    ],
    "limitations": [
      "principal_axis_proxy",
      "obb_axis_proxy"
    ],
    "derived_from": [
      "geometry_schema.v1.json"
    ],
    "assertion_level": "measured",
    "inference_basis": "oriented_bbox_alignment",
    "measurement_method": "obb_axis_comparison",
    "verification_status": "partially_verified",
    "verification_required": [
      "tolerance_review"
    ],
    "confidence_basis": [
      "dominant axis similarity from oriented bbox"
    ]
  },
  {
    "relation_id": "rel-parallel-5",
    "subject_id": "102211a6-9d1d-477e-a081-e5ef0756cf9a",
    "predicate": "parallel_to",
    "object_id": "8276da53-2a80-4eb0-859c-a51d37bf9a0a",
    "relation_type": "spatial",
    "directionality": "symmetric",
    "confidence": 0.72,
    "tolerance_context": {
      "linear_tolerance": 0.05,
      "angular_tolerance": 2.0,
      "unit_system": "model_unit"
    },
    "observation_refs": [
      "obs:axis-orientation:102211a6-9d1d-477e-a081-e5ef0756cf9a:8276da53-2a80-4eb0-859c-a51d37bf9a0a",
      "obs:obb-axis-dot:1.000"
    ],
    "limitations": [
      "axis_orientation_proxy",
      "obb_axis_proxy"
    ],
    "derived_from": [
      "geometry_schema.v1.json"
    ],
    "assertion_level": "measured",
    "inference_basis": "oriented_bbox_alignment",
    "measurement_method": "obb_axis_comparison",
    "verification_status": "partially_verified",
    "verification_required": [
      "tolerance_review"
    ],
    "confidence_basis": [
      "axis dot product from oriented bbox"
    ]
  }
]